Nombre,Fecha,Email,RutaImagen,RutaFirma,RutaQR,NombreFirma,TextoParametrizable
Eduardo Melo,2024-07-01,lal0mel0@hotmail.com,imagenes/imagen1.jpg,firmas/firma1.jpg,qrs/qr1.jpg,Lic. Juan Mario,Participante destacado en el coloquio anual sobre tecnología y sociedad.
Ana López,2024-07-02,ana.lopez@email.com,imagenes/imagen2.jpg,firmas/firma2.jpg,qrs/qr2.jpg,Dr. Carlos García,Reconocimiento por su contribución en el campo de la medicina.
Pedro Ramirez,2024-07-03,pedro.ramirez@email.com,imagenes/imagen3.jpg,firmas/firma3.jpg,qrs/qr3.jpg,Dra. Laura Martínez,Excelencia académica y participación activa en eventos educativos.
María González,2024-07-04,maria.gonzalez@email.com,imagenes/imagen4.jpg,firmas/firma4.jpg,qrs/qr4.jpg,Ing. Roberto Sánchez,Contribución sobresaliente en el ámbito de la ingeniería y la innovación.
Luisa Martínez,2024-07-05,luisa.martinez@email.com,imagenes/imagen5.jpg,firmas/firma5.jpg,qrs/qr5.jpg,Prof. Adriana Hernández,Participante destacada en el coloquio internacional de literatura y cultura.
